<?xml version="1.0" encoding="utf-8"?>
<!ELEMENT rss (channel+)>
<!ELEMENT channel (item+)>
<!ELEMENT item (title, description+, link, author+)>
<!ELEMENT title (#PCDATA)>
<!ELEMENT link (#PCDATA)>
<!ELEMENT author (#PCDATA)>
<!ELEMENT description (#PCDATA)>
